{
  "$schema": "http://json-schema.org/draft-07/schema#",
  "$id": "https://github.com/OmarMokhtar-Saad/claudekit/config.schema.json",
  "title": "ClaudeKit Configuration",
  "description": "Configuration schema for .claude/hooks/config.json",
  "type": "object",
  "properties": {
    "_note": {
      "type": "string",
      "description": "Free-text maintainer note. JSON has no comments, so an underscore-prefixed key carries the deprecation notice for this file."
    },
    "hooks": {
      "type": "object",
      "additionalProperties": false,
      "properties": {
        "pre-commit": {
          "type": "object",
          "additionalProperties": false,
          "properties": {
            "command": { "type": "string" },
            "enabled": { "type": "boolean", "default": true },
            "timeout": { "type": "integer", "minimum": 1000, "maximum": 600000, "default": 30000 },
            "blocking": { "type": "boolean", "default": true },
            "description": { "type": "string", "description": "Human-readable note about what this hook does." }
          }
        },
        "post-implement": {
          "type": "object",
          "additionalProperties": false,
          "properties": {
            "command": { "type": "string" },
            "enabled": { "type": "boolean", "default": true },
            "timeout": { "type": "integer", "minimum": 1000, "maximum": 600000, "default": 120000 },
            "blocking": { "type": "boolean", "default": false },
            "description": { "type": "string", "description": "Human-readable note about what this hook does." }
          }
        },
        "pre-plan": {
          "type": "object",
          "additionalProperties": false,
          "properties": {
            "command": { "type": "string" },
            "enabled": { "type": "boolean", "default": true },
            "timeout": { "type": "integer", "minimum": 1000, "maximum": 600000, "default": 5000 },
            "blocking": { "type": "boolean", "default": false },
            "description": { "type": "string", "description": "Human-readable note about what this hook does." }
          }
        },
        "pre-push": {
          "type": "object",
          "additionalProperties": false,
          "properties": {
            "command": { "type": "string" },
            "enabled": { "type": "boolean", "default": true },
            "timeout": { "type": "integer", "minimum": 1000, "maximum": 600000, "default": 300000 },
            "blocking": { "type": "boolean", "default": true },
            "description": { "type": "string", "description": "Human-readable note about what this hook does." }
          }
        },
        "post-tool-use": {
          "type": "object",
          "additionalProperties": false,
          "properties": {
            "command": { "type": "string" },
            "enabled": { "type": "boolean", "default": true },
            "timeout": { "type": "integer", "minimum": 1000, "maximum": 600000, "default": 5000 },
            "blocking": { "type": "boolean", "default": false },
            "description": { "type": "string", "description": "Human-readable note about what this hook does." },
            "tools": { "type": "array", "items": { "type": "string" }, "description": "Tool names this hook reacts to (e.g. Edit, Write, Bash)." }
          }
        },
        "file-guard": {
          "type": "object",
          "additionalProperties": false,
          "description": "Warns on paths matching the sensitive-file classifier's 18 categories (env files, credentials, keys, certificates, wallets, production data). ADVISORY: the wrapper file-guard-gate.sh exits 0 always and runs only under ECC_HOOK_PROFILE=strict. A pattern count is deliberately not quoted here -- the previous \"195+\" overstated a ~47-pattern script by about 4x, and a hand-written count drifts the moment the script is edited.",
          "properties": {
            "command": { "type": "string", "description": "Command to run for file-guard check" },
            "enabled": { "type": "boolean", "default": true },
            "timeout": { "type": "integer", "minimum": 1000, "maximum": 600000, "default": 5000 },
            "blocking": { "type": "boolean", "default": true },
            "description": { "type": "string", "default": "Warns (advisory, strict profile only) on sensitive-looking paths" }
          }
        },
        "check-comment-replacement": {
          "type": "object",
          "additionalProperties": false,
          "description": "Detects when code comments are replaced with implementation stubs or placeholders. SHIPPED BUT NOT WIRED: it has zero references in .claude/settings.json, so nothing invokes it. Documented here so the option block is not mistaken for a running hook; wiring it is a separate, owner-gated decision.",
          "properties": {
            "command": { "type": "string", "description": "Command to run for comment replacement check" },
            "enabled": { "type": "boolean", "default": true },
            "timeout": { "type": "integer", "minimum": 1000, "maximum": 600000, "default": 10000 },
            "blocking": { "type": "boolean", "default": true },
            "description": { "type": "string", "default": "Detects when code comments are replaced with implementation stubs" }
          }
        },
        "prompt-injection-scanner": {
          "type": "object",
          "additionalProperties": false,
          "description": "Scans for prompt injection patterns in files and inputs",
          "properties": {
            "command": { "type": "string", "description": "Command to run for prompt injection scanning" },
            "enabled": { "type": "boolean", "default": true },
            "timeout": { "type": "integer", "minimum": 1000, "maximum": 600000, "default": 10000 },
            "blocking": { "type": "boolean", "default": true },
            "description": { "type": "string", "default": "Scans for prompt injection patterns in files and inputs" }
          }
        },
        "auto-checkpoint": {
          "type": "object",
          "additionalProperties": false,
          "description": "Automatically creates checkpoints before significant operations",
          "properties": {
            "command": { "type": "string", "description": "Command to run for auto-checkpoint" },
            "enabled": { "type": "boolean", "default": true },
            "timeout": { "type": "integer", "minimum": 1000, "maximum": 600000, "default": 15000 },
            "blocking": { "type": "boolean", "default": false },
            "description": { "type": "string", "default": "Automatically creates checkpoints before significant operations" }
          }
        }
      }
    },
    "global": {
      "type": "object",
      "additionalProperties": false,
      "properties": {
        "disabled": { "type": "boolean", "default": false },
        "logLevel": { "type": "string", "enum": ["debug", "info", "warn", "error"], "default": "info" },
        "logFile": { "type": "string", "default": ".claude/hooks/hooks.log" },
        "maxConcurrentHooks": { "type": "integer", "minimum": 1, "maximum": 10, "default": 3 }
      }
    },
    "project": {
      "type": "object",
      "additionalProperties": false,
      "properties": {
        "build_cmd": { "type": "string", "description": "Build command (e.g., npm run build)" },
        "test_cmd": { "type": "string", "description": "Test command (e.g., pytest)" },
        "lint_cmd": { "type": "string", "description": "Lint command (e.g., eslint .)" },
        "coverage_cmd": { "type": "string", "description": "Coverage command (e.g., pytest --cov)" }
      }
    },
    "security": {
      "type": "object",
      "additionalProperties": false,
      "properties": {
        "safeMode": { "type": "boolean", "default": false, "description": "Restrict hook commands to the allowlist (off: denylist only)" },
        "allowedCommands": {
          "type": "array",
          "items": { "type": "string" },
          "description": "Additional allowed commands beyond defaults"
        },
        "blockedCommands": {
          "type": "array",
          "items": { "type": "string" },
          "description": "Additional blocked commands"
        },
        "projectTools": {
          "type": "array",
          "items": { "type": "string" },
          "description": "Command heads that drive a device or build sandbox rather than the host (e.g. adb, emulator, gradle, ./gradlew, xcrun). Exempt from the allowlist and from the whole-command host-pattern scan; NEVER exempt from the blocklist."
        },
        "timeout": { "type": "integer", "minimum": 1000, "maximum": 600000, "default": 30000 }
      }
    }
  },
  "additionalProperties": false
}
